{
  "$schema": "https://json-schema.org/draft/2020-12/schema",
  "$id": "https://weaver-spec.dev/contracts/v0/capability_token.schema.json",
  "title": "CapabilityToken",
  "description": "A signed, scoped authorization credential that grants the bearer permission to invoke specific capabilities. Issued by agent-kernel. Must be scoped and have an expiry or single-use flag.",
  "x_weaver_stability": "stable",
  "type": "object",
  "required": ["token_id", "principal", "scope", "issued_at"],
  "properties": {
    "token_id": {
      "type": "string",
      "minLength": 1,
      "description": "Unique identifier for this token."
    },
    "principal": {
      "type": "string",
      "minLength": 1,
      "description": "Identity of the principal (user, agent, or service) this token was issued to."
    },
    "scope": {
      "type": "array",
      "items": {"type": "string", "minLength": 1},
      "minItems": 1,
      "description": "List of capability IDs this token authorizes. Must not be empty; unbounded scope is not permitted."
    },
    "issued_at": {
      "type": "string",
      "format": "date-time",
      "description": "ISO 8601 timestamp of when this token was issued."
    },
    "expires_at": {
      "type": ["string", "null"],
      "format": "date-time",
      "description": "ISO 8601 expiry timestamp. Null only if single_use is true."
    },
    "single_use": {
      "type": "boolean",
      "description": "If true, this token is invalidated after a single successful authorization. expires_at may be null for single-use tokens.",
      "default": false
    },
    "issuer": {
      "type": "string",
      "description": "Optional identifier of the agent-kernel instance that issued this token."
    },
    "metadata": {
      "type": "object",
      "description": "Optional implementation-specific metadata.",
      "additionalProperties": true
    }
  },
  "anyOf": [
    {
      "properties": {
        "single_use": { "const": true }
      },
      "required": ["single_use"]
    },
    {
      "properties": {
        "expires_at": { "type": "string", "format": "date-time" }
      },
      "required": ["expires_at"]
    }
  ],
  "additionalProperties": true
}
